{
  "_id": "507f1f77bcf86cd799439011",
  "planId": "a0eebc99-9c0b-4ef8-bb6d-6bb9bd380a11",
  "planNumber": "PLAN-2024-04",
  "calculatedAt": "2024-04-06T10:30:00Z",
  "horizonDays": 30,
  "status": "COMPLETED",
  "totalMaterials": 150,
  "totalDeficit": 25000.50,
  "urgentCount": 12,
  "totalBudget": 3750000.00,
  "calculatedBy": "user-ivanov-uuid-123",
  "items": [
    {
      "id": "item-001-uuid-456",
      "resultId": "507f1f77bcf86cd799439011",
      "materialId": "mat-steel-001",
      "materialName": "Сталь листовая 2мм",
      "materialSku": "ST-2MM-1000",
      "unitOfMeasure": "кг",
      "requiredQty": 1000,
      "availableQty": 300,
      "deficit": 700,
      "safetyStockQty": 100,
      "recommendedOrderDate": "2024-04-10",
      "requiredDeliveryDate": "2024-04-20",
      "leadTimeDays": 10,
      "recommendedSupplierId": "sup-metalprom-001",
      "recommendedSupplierName": "ООО МеталлПром",
      "estimatedUnitPrice": 150.50,
      "totalBudget": 105350.00,
      "priority": "HIGH",
      "isCritical": true,
      "sourcePlanNumber": "PLAN-2024-04",
      "sourceProductionOrders": ["WO-001", "WO-005", "WO-012"]
    },
    {
      "id": "item-002-uuid-789",
      "resultId": "507f1f77bcf86cd799439011",
      "materialId": "mat-aluminum-002",
      "materialName": "Алюминий профильный",
      "materialSku": "AL-PROF-50",
      "unitOfMeasure": "м",
      "requiredQty": 500,
      "availableQty": 450,
      "deficit": 50,
      "safetyStockQty": 25,
      "recommendedOrderDate": "2024-04-15",
      "requiredDeliveryDate": "2024-04-25",
      "leadTimeDays": 10,
      "recommendedSupplierId": "sup-alutorg-002",
      "recommendedSupplierName": "ООО АлюминийТорг",
      "estimatedUnitPrice": 250.00,
      "totalBudget": 12500.00,
      "priority": "MEDIUM",
      "isCritical": false,
      "sourcePlanNumber": "PLAN-2024-04",
      "sourceProductionOrders": ["WO-003"]
    }
  ]
}